{
 "version": 1,
 "nombre": "w6a0_k2",
 "params": {
  "mass": 0.02,
  "tension": 200,
  "compression": 60,
  "shear": 60,
  "bending": 120.24,
  "bend_max": 400,
  "quality": 15,
  "air": 1.0,
  "soft": 1.0,
  "sew_max": 80,
  "fric": 40,
  "tfric": 40,
  "hfric": 40,
  "bth": 0.001,
  "ath": 0.001,
  "cd": 0.004,
  "th": 0.008,
  "selfcol": 1,
  "self_d": 0.002,
  "sf": 5,
  "head": 1,
  "g0": 4,
  "g1": 16,
  "abd_end": 20,
  "arm_end": 20,
  "arm_f0": 24,
  "arm_f1": 60,
  "arm_x1": -1,
  "bgrow": 2,
  "pres": 0,
  "p0": 0,
  "K": 3,
  "stop_f6": 30,
  "stop_open": 8,
  "settle_min": 0,
  "renders": 1,
  "msym": 1,
  "mano": 0,
  "deltoid": 0,
  "nar": 0,
  "w_cuff": 0.3,
  "w_band": 0,
  "w_neck": 0,
  "w_plk": 1,
  "cuff_on": 1,
  "q_ramp": 0,
  "fmp": 2,
  "snaps": 1,
  "rk_f0": 2,
  "rk_df": 8
 },
 "dumps": [
  1,
  2,
  3,
  4,
  5,
  6,
  12,
  24,
  36,
  48,
  60,
  72,
  96,
  120,
  150
 ],
 "malla": "w2094_v0_v6.json",
 "cuerpo": "cuerpo_W2094_piel20.npz",
 "frames": 150
}